{
    "schema_version": 1,
    "package_id": "fuel_stations_2011",
    "method_id": "7_1_receive",
    "formula_code": "7.1_receive",
    "cases": [
        {
            "case_id": "7_1_receive_golden_01",
            "title": "7.1_receive baseline runtime scenario",
            "status": "active",
            "evidence": {
                "document": "Order 196-oe",
                "section": "7.1_receive",
                "page": 31,
                "image_ref": null
            },
            "inputs": {
                "substance": "gasoline_auto",
                "climate_zone": "middle",
                "tank_type": "underground",
                "PZV_receive": 0,
                "V_sl": 1,
                "t_unload": 20,
                "Qoz": 1,
                "Qvl": 1
            },
            "expected_outputs": {
                "M": {
                    "value": 24.0,
                    "tolerance": {
                        "abs": 1e-09,
                        "rel": 1e-09
                    },
                    "unit_id": "g_per_s"
                },
                "G": {
                    "value": 0.0005901999999999999,
                    "tolerance": {
                        "abs": 1e-09,
                        "rel": 1e-09
                    },
                    "unit_id": "t_per_yr"
                }
            },
            "expected_lookups": {
                "C_tank_max": {
                    "value": 480.0,
                    "tolerance": {
                        "abs": 1e-12,
                        "rel": 0.0
                    },
                    "unit_id": "g_per_m3"
                },
                "C_tank_oz": {
                    "value": 210.2,
                    "tolerance": {
                        "abs": 1e-12,
                        "rel": 0.0
                    },
                    "unit_id": "g_per_m3"
                },
                "C_tank_vl": {
                    "value": 255.0,
                    "tolerance": {
                        "abs": 1e-12,
                        "rel": 0.0
                    },
                    "unit_id": "g_per_m3"
                },
                "J": {
                    "value": 125.0,
                    "tolerance": {
                        "abs": 1e-12,
                        "rel": 0.0
                    },
                    "unit_id": "g_per_m3"
                }
            },
            "expected_equations": [
                {
                    "lhs_token": "M",
                    "equation_order": 1,
                    "expected": {
                        "value": 24.0,
                        "tolerance": {
                            "abs": 1e-09,
                            "rel": 1e-09
                        },
                        "unit_id": "g_per_s"
                    },
                    "tolerance": {
                        "abs": 1e-09,
                        "rel": 1e-09
                    }
                },
                {
                    "lhs_token": "G_zak",
                    "equation_order": 2,
                    "expected": {
                        "value": 0.0004652,
                        "tolerance": {
                            "abs": 1e-09,
                            "rel": 1e-09
                        },
                        "unit_id": "t_per_yr"
                    },
                    "tolerance": {
                        "abs": 1e-09,
                        "rel": 1e-09
                    }
                },
                {
                    "lhs_token": "G_pr_r",
                    "equation_order": 3,
                    "expected": {
                        "value": 0.000125,
                        "tolerance": {
                            "abs": 1e-09,
                            "rel": 1e-09
                        },
                        "unit_id": "t_per_yr"
                    },
                    "tolerance": {
                        "abs": 1e-09,
                        "rel": 1e-09
                    }
                },
                {
                    "lhs_token": "G",
                    "equation_order": 4,
                    "expected": {
                        "value": 0.0005901999999999999,
                        "tolerance": {
                            "abs": 1e-09,
                            "rel": 1e-09
                        },
                        "unit_id": "t_per_yr"
                    },
                    "tolerance": {
                        "abs": 1e-09,
                        "rel": 1e-09
                    }
                }
            ]
        }
    ]
}
