{
    "schema_version": 1,
    "package_id": "fuel_stations_2011",
    "method_id": "7_1_refuel",
    "formula_code": "7.1_refuel",
    "cases": [
        {
            "case_id": "7_1_refuel_equation_01",
            "title": "7.1_refuel equation M",
            "status": "active",
            "source_equation_ids": [
                "7.1.2"
            ],
            "evidence": {
                "document": "Order 196-oe",
                "section": "7.1_refuel",
                "page": 32,
                "image_ref": null
            },
            "inputs": {
                "substance": "gasoline_auto",
                "climate_zone": "middle",
                "PZV_refuel": 0,
                "VTRK": 1,
                "NN": 1,
                "Qoz": 1,
                "Qvl": 1
            },
            "target": {
                "lhs_token": "M",
                "equation_order": 1
            },
            "expected": {
                "value": 0.27,
                "tolerance": {
                    "abs": 1e-09,
                    "rel": 1e-09
                },
                "unit_id": "g_per_s"
            },
            "tolerance": {
                "abs": 1e-09,
                "rel": 1e-09
            }
        }
    ]
}
