{
    "schema_version": 1,
    "package_id": "fuel_stations_2011",
    "method_id": "7_1_combined",
    "formula_code": "7.1_combined",
    "cases": [
        {
            "case_id": "7_1_combined_equation_01",
            "title": "7.1_combined equation M_recv",
            "status": "active",
            "source_equation_ids": [
                "7.1.1"
            ],
            "evidence": {
                "document": "Order 196-oe",
                "section": "7.1_combined",
                "page": 31,
                "image_ref": null
            },
            "inputs": {
                "substance": "gasoline_auto",
                "climate_zone": "middle",
                "tank_type": "underground",
                "tank_type_storage": "underground",
                "PZV_receive": 0,
                "PZV_refuel": 0,
                "NP": 1,
                "tank_volume_cat": "100",
                "V_sl": 1,
                "t_unload": 20,
                "VTRK": 1,
                "NN": 1,
                "Qoz": 1,
                "Qvl": 1
            },
            "target": {
                "lhs_token": "M_recv",
                "equation_order": 1
            },
            "expected": {
                "value": 24.0,
                "tolerance": {
                    "abs": 1e-09,
                    "rel": 1e-09
                },
                "unit_id": "dimensionless"
            },
            "tolerance": {
                "abs": 1e-09,
                "rel": 1e-09
            }
        }
    ]
}
