{
    "schema_version": 1,
    "package_id": "fuel_stations_2011",
    "method_id": "4_2_oil_gasoline_r38",
    "formula_code": "4.2",
    "cases": [
        {
            "case_id": "4_2_oil_gasoline_r38_golden_01",
            "title": "4.2 baseline runtime scenario",
            "status": "active",
            "evidence": {
                "document": "Order 196-oe",
                "section": "4.2",
                "page": 17,
                "image_ref": null
            },
            "inputs": {
                "productBoilGroup": "light",
                "t_liq_max": -30,
                "t_liq_min": -30,
                "B_year": 1,
                "P38_src": 0,
                "Vch_max": 1,
                "rho_liq": 1,
                "t_nk": 30,
                "n_turnover": 100,
                "V_nom": 0,
                "B_oz": 1,
                "B_vl": 1,
                "tank_construction": "vert",
                "tank_mode_recv": "mernik",
                "ssv_type": "none"
            },
            "expected_outputs": {
                "M": {
                    "value": 0.0,
                    "tolerance": {
                        "abs": 1e-09,
                        "rel": 1e-09
                    },
                    "unit_id": "g_per_s"
                },
                "G": {
                    "value": 0.0,
                    "tolerance": {
                        "abs": 1e-09,
                        "rel": 1e-09
                    },
                    "unit_id": "t_per_yr"
                }
            },
            "expected_lookups": {
                "m_vapor": {
                    "value": 60.0,
                    "tolerance": {
                        "abs": 1e-12,
                        "rel": 0.0
                    },
                    "unit_id": "g_per_mol"
                },
                "Kt_max": {
                    "value": 0.09,
                    "tolerance": {
                        "abs": 1e-12,
                        "rel": 0.0
                    },
                    "unit_id": "dimensionless"
                },
                "Kt_min": {
                    "value": 0.09,
                    "tolerance": {
                        "abs": 1e-12,
                        "rel": 0.0
                    },
                    "unit_id": "dimensionless"
                },
                "Kp_max": {
                    "value": 0.9,
                    "tolerance": {
                        "abs": 1e-12,
                        "rel": 0.0
                    },
                    "unit_id": "dimensionless"
                },
                "Kp_avg": {
                    "value": 0.63,
                    "tolerance": {
                        "abs": 1e-12,
                        "rel": 0.0
                    },
                    "unit_id": "dimensionless"
                },
                "Kv": {
                    "value": 1.0,
                    "tolerance": {
                        "abs": 1e-12,
                        "rel": 0.0
                    },
                    "unit_id": "dimensionless"
                },
                "Kob": {
                    "value": 1.35,
                    "tolerance": {
                        "abs": 1e-12,
                        "rel": 0.0
                    },
                    "unit_id": "dimensionless"
                }
            },
            "expected_equations": [
                {
                    "lhs_token": "M",
                    "equation_order": 1,
                    "expected": {
                        "value": 0.0,
                        "tolerance": {
                            "abs": 1e-09,
                            "rel": 1e-09
                        },
                        "unit_id": "g_per_s"
                    },
                    "tolerance": {
                        "abs": 1e-09,
                        "rel": 1e-09
                    }
                },
                {
                    "lhs_token": "G_422",
                    "equation_order": 2,
                    "expected": {
                        "value": 0.0,
                        "tolerance": {
                            "abs": 1e-09,
                            "rel": 1e-09
                        },
                        "unit_id": "t_per_yr"
                    },
                    "tolerance": {
                        "abs": 1e-09,
                        "rel": 1e-09
                    }
                },
                {
                    "lhs_token": "G_423",
                    "equation_order": 3,
                    "expected": {
                        "value": 0.0,
                        "tolerance": {
                            "abs": 1e-09,
                            "rel": 1e-09
                        },
                        "unit_id": "t_per_yr"
                    },
                    "tolerance": {
                        "abs": 1e-09,
                        "rel": 1e-09
                    }
                },
                {
                    "lhs_token": "G",
                    "equation_order": 4,
                    "expected": {
                        "value": 0.0,
                        "tolerance": {
                            "abs": 1e-09,
                            "rel": 1e-09
                        },
                        "unit_id": "t_per_yr"
                    },
                    "tolerance": {
                        "abs": 1e-09,
                        "rel": 1e-09
                    }
                }
            ]
        }
    ]
}
