{
  "schema_version": 1,
  "package_id": "paint_2004",
  "method_id": "5_3_volatile_max",
  "formula_code": "5.3",
  "cases": [
    {
      "case_id": "paint_pf115_pneumatic_xylol_max",
      "title": "ПФ-115, ксилол, максимальный выброс",
      "status": "active",
      "evidence": {
        "document": "РНД 211.2.02.05-2004",
        "section": "5.3",
        "page": 9,
        "image_ref": null
      },
      "inputs": {
        "material_key": "эмали_пф_115",
        "paint_method": "Пневматический",
        "pollutant_key": "0616",
        "m_m_kgph": 20,
        "eta_cleaning": 0
      },
      "expected_outputs": {
        "M_comp_paint_gps": {
          "value": 0.3125,
          "unit_id": "g_per_s"
        },
        "M_comp_dry_gps": {
          "value": 0.9375,
          "unit_id": "g_per_s"
        },
        "M_comp_total_gps": {
          "value": 1.25,
          "unit_id": "g_per_s"
        }
      },
      "expected_lookups": {
        "fr_pct": {
          "value": 45.0,
          "unit_id": "pct"
        },
        "delta_r_paint_pct": {
          "value": 25.0,
          "unit_id": "pct"
        },
        "delta_r_dry_pct": {
          "value": 75.0,
          "unit_id": "pct"
        },
        "delta_x_pct": {
          "value": 50.0,
          "unit_id": "pct"
        }
      }
    }
  ]
}
