{
    "schema_version":  1,
    "package_id":  "fuel_stations_2011",
    "method_id":  "7_1_storage",
    "formula_code":  "7.1_storage",
    "cases":  [
                  {
                      "case_id":  "7_1_storage_lookup_01",
                      "title":  "7.1_storage lookup baseline",
                      "status":  "active",
                      "binding_target":  "Knp",
                      "table_id":  "Table_12",
                      "output_key":  "Knp",
                      "resolution":  "exact",
                      "evidence":  {
                                       "document":  "Prikaz OOS RK 2011 No. 196-O",
                                       "section":  "Appendix 12",
                                       "page":  null,
                                       "image_ref":  "assets/tables/Table_12.png"
                                   },
                      "selectors":  {
                                        "substance":  "gasoline_auto",
                                        "climate_zone":  "middle"
                                    },
                      "expected":  {
                                       "value":  1.0,
                                       "tolerance":  {
                                                         "abs":  1E-12,
                                                         "rel":  0.0
                                                     }
                                   },
                      "tolerance":  {
                                        "abs":  1E-12,
                                        "rel":  0.0
                                    }
                  },
                  {
                      "case_id":  "7_1_storage_lookup_02_storage_loss",
                      "title":  "7.1_storage Appendix 13 storage lookup",
                      "status":  "active",
                      "binding_target":  "GXP",
                      "table_id":  "Table_Appendix_13",
                      "output_key":  "GXP",
                      "resolution":  "exact",
                      "selectors":  {
                                        "substance":  "gasoline_auto",
                                        "climate_zone":  "middle",
                                        "tank_type":  "underground",
                                        "tank_volume_cat":  "100"
                                    },
                      "expected":  {
                                       "value":  0.066,
                                       "tolerance":  {
                                                         "abs":  1E-12,
                                                         "rel":  0.0
                                                     },
                                       "unit_id":  "t_per_yr"
                                   },
                      "tolerance":  {
                                        "abs":  1E-12,
                                        "rel":  0.0
                                    }
                  },
                  {
                      "case_id":  "7_1_storage_lookup_03_unsupported_substance",
                      "title":  "7.1_storage blocks unsupported storage-table substance",
                      "status":  "active",
                      "binding_target":  "GXP",
                      "table_id":  "Table_Appendix_13",
                      "output_key":  "GXP",
                      "resolution":  "exact",
                      "selectors":  {
                                        "substance":  "benzene",
                                        "climate_zone":  "middle",
                                        "tank_type":  "underground",
                                        "tank_volume_cat":  "100"
                                    },
                      "expect_error":  true,
                      "expected_error":  {
                                             "contains":  "No matching exact row"
                                         }
                  }
              ]
}