{
    "schema_version": 1,
    "package_id": "fuel_stations_2011",
    "method_id": "7_1_combined",
    "formula_code": "7.1_combined",
    "cases": [
        {
            "case_id": "7_1_combined_golden_01",
            "title": "7.1_combined baseline runtime scenario",
            "status": "active",
            "evidence": {
                "document": "Order 196-oe",
                "section": "7.1_combined",
                "page": 31,
                "image_ref": null
            },
            "inputs": {
                "substance": "gasoline_auto",
                "climate_zone": "middle",
                "tank_type": "underground",
                "tank_type_storage": "underground",
                "PZV_receive": 0,
                "PZV_refuel": 0,
                "NP": 1,
                "tank_volume_cat": "100",
                "V_sl": 1,
                "t_unload": 20,
                "VTRK": 1,
                "NN": 1,
                "Qoz": 1,
                "Qvl": 1
            },
            "expected_outputs": {
                "M": {
                    "value": 24.0,
                    "tolerance": {
                        "abs": 1e-09,
                        "rel": 1e-09
                    },
                    "unit_id": "g_per_s"
                },
                "G": {
                    "value": 0.06765020000000001,
                    "tolerance": {
                        "abs": 1e-09,
                        "rel": 1e-09
                    },
                    "unit_id": "t_per_yr"
                }
            },
            "expected_lookups": {
                "C_tank_max": {
                    "value": 480.0,
                    "tolerance": {
                        "abs": 1e-12,
                        "rel": 0.0
                    },
                    "unit_id": "g_per_m3"
                },
                "C_tank_oz": {
                    "value": 210.2,
                    "tolerance": {
                        "abs": 1e-12,
                        "rel": 0.0
                    },
                    "unit_id": "g_per_m3"
                },
                "C_tank_vl": {
                    "value": 255.0,
                    "tolerance": {
                        "abs": 1e-12,
                        "rel": 0.0
                    },
                    "unit_id": "g_per_m3"
                },
                "C_ba_max": {
                    "value": 972.0,
                    "tolerance": {
                        "abs": 1e-12,
                        "rel": 0.0
                    },
                    "unit_id": "g_per_m3"
                },
                "C_ba_oz": {
                    "value": 420.0,
                    "tolerance": {
                        "abs": 1e-12,
                        "rel": 0.0
                    },
                    "unit_id": "g_per_m3"
                },
                "C_ba_vl": {
                    "value": 515.0,
                    "tolerance": {
                        "abs": 1e-12,
                        "rel": 0.0
                    },
                    "unit_id": "g_per_m3"
                },
                "J": {
                    "value": 125.0,
                    "tolerance": {
                        "abs": 1e-12,
                        "rel": 0.0
                    },
                    "unit_id": "g_per_m3"
                },
                "Knp": {
                    "value": 1.0,
                    "tolerance": {
                        "abs": 1e-12,
                        "rel": 0.0
                    }
                },
                "GXP": {
                    "value": 0.066,
                    "tolerance": {
                        "abs": 1e-12,
                        "rel": 0.0
                    },
                    "unit_id": "t_per_yr"
                }
            },
            "expected_equations": [
                {
                    "lhs_token": "M_recv",
                    "equation_order": 1,
                    "expected": {
                        "value": 24.0,
                        "tolerance": {
                            "abs": 1e-09,
                            "rel": 1e-09
                        },
                        "unit_id": "dimensionless"
                    },
                    "tolerance": {
                        "abs": 1e-09,
                        "rel": 1e-09
                    }
                },
                {
                    "lhs_token": "G_zak",
                    "equation_order": 2,
                    "expected": {
                        "value": 0.0004652,
                        "tolerance": {
                            "abs": 1e-09,
                            "rel": 1e-09
                        },
                        "unit_id": "t_per_yr"
                    },
                    "tolerance": {
                        "abs": 1e-09,
                        "rel": 1e-09
                    }
                },
                {
                    "lhs_token": "G_pr_r",
                    "equation_order": 3,
                    "expected": {
                        "value": 0.000125,
                        "tolerance": {
                            "abs": 1e-09,
                            "rel": 1e-09
                        },
                        "unit_id": "t_per_yr"
                    },
                    "tolerance": {
                        "abs": 1e-09,
                        "rel": 1e-09
                    }
                },
                {
                    "lhs_token": "G_recv",
                    "equation_order": 4,
                    "expected": {
                        "value": 0.0005901999999999999,
                        "tolerance": {
                            "abs": 1e-09,
                            "rel": 1e-09
                        },
                        "unit_id": "t_per_yr"
                    },
                    "tolerance": {
                        "abs": 1e-09,
                        "rel": 1e-09
                    }
                },
                {
                    "lhs_token": "G_storage",
                    "equation_order": 5,
                    "expected": {
                        "value": 0.066,
                        "tolerance": {
                            "abs": 1e-09,
                            "rel": 1e-09
                        },
                        "unit_id": "t_per_yr"
                    },
                    "tolerance": {
                        "abs": 1e-09,
                        "rel": 1e-09
                    }
                },
                {
                    "lhs_token": "M_refuel",
                    "equation_order": 6,
                    "expected": {
                        "value": 0.27,
                        "tolerance": {
                            "abs": 1e-09,
                            "rel": 1e-09
                        },
                        "unit_id": "dimensionless"
                    },
                    "tolerance": {
                        "abs": 1e-09,
                        "rel": 1e-09
                    }
                },
                {
                    "lhs_token": "G_ba",
                    "equation_order": 7,
                    "expected": {
                        "value": 0.000935,
                        "tolerance": {
                            "abs": 1e-09,
                            "rel": 1e-09
                        },
                        "unit_id": "t_per_yr"
                    },
                    "tolerance": {
                        "abs": 1e-09,
                        "rel": 1e-09
                    }
                },
                {
                    "lhs_token": "G_pr_a",
                    "equation_order": 8,
                    "expected": {
                        "value": 0.000125,
                        "tolerance": {
                            "abs": 1e-09,
                            "rel": 1e-09
                        },
                        "unit_id": "t_per_yr"
                    },
                    "tolerance": {
                        "abs": 1e-09,
                        "rel": 1e-09
                    }
                },
                {
                    "lhs_token": "G_refuel",
                    "equation_order": 9,
                    "expected": {
                        "value": 0.00106,
                        "tolerance": {
                            "abs": 1e-09,
                            "rel": 1e-09
                        },
                        "unit_id": "t_per_yr"
                    },
                    "tolerance": {
                        "abs": 1e-09,
                        "rel": 1e-09
                    }
                },
                {
                    "lhs_token": "M",
                    "equation_order": 10,
                    "expected": {
                        "value": 24.0,
                        "tolerance": {
                            "abs": 1e-09,
                            "rel": 1e-09
                        },
                        "unit_id": "g_per_s"
                    },
                    "tolerance": {
                        "abs": 1e-09,
                        "rel": 1e-09
                    }
                },
                {
                    "lhs_token": "G",
                    "equation_order": 11,
                    "expected": {
                        "value": 0.06765020000000001,
                        "tolerance": {
                            "abs": 1e-09,
                            "rel": 1e-09
                        },
                        "unit_id": "t_per_yr"
                    },
                    "tolerance": {
                        "abs": 1e-09,
                        "rel": 1e-09
                    }
                }
            ]
        }
    ]
}
