{
  "schema_version": 1,
  "package_id": "paint_2004",
  "method_id": "5_1_aerosol",
  "formula_code": "5.1",
  "cases": [
    {
      "case_id": "paint_5_1_aerosol_equation_01",
      "title": "5.1 aerosol gross equation",
      "status": "active",
      "source_equation_ids": [
        "5.1.1",
        "5.5.1"
      ],
      "evidence": {
        "document": "РНД 211.2.02.05-2004",
        "section": "5.1",
        "page": 8,
        "image_ref": null
      },
      "inputs": {
        "material_key": "эмали_пф_115",
        "paint_method": "Пневматический",
        "m_f_tpy": 8,
        "m_m_kgph": 20,
        "K_os": 0.8,
        "eta_cleaning": 0
      },
      "target": {
        "lhs_token": "M_aerosol_gross_tpy",
        "equation_order": 1
      },
      "expected": {
        "value": 1.056,
        "unit_id": "t_per_yr"
      }
    }
  ]
}
