{
  "schema_version": 1,
  "package_id": "paint_2004",
  "method_id": "5_2_volatile_gross",
  "formula_code": "5.2",
  "cases": [
    {
      "case_id": "paint_5_2_total_equation_01",
      "title": "5.2 total annual volatile equation",
      "status": "active",
      "source_equation_ids": [
        "5.2.7"
      ],
      "evidence": {
        "document": "РНД 211.2.02.05-2004",
        "section": "5.2",
        "page": 9,
        "image_ref": null
      },
      "inputs": {
        "material_key": "эмали_пф_115",
        "paint_method": "Пневматический",
        "pollutant_key": "0616",
        "m_f_tpy": 8,
        "eta_cleaning": 0
      },
      "target": {
        "lhs_token": "M_comp_total_tpy",
        "equation_order": 3
      },
      "expected": {
        "value": 1.8,
        "unit_id": "t_per_yr"
      }
    }
  ]
}
