{
    "schema_version":  1,
    "package_id":  "fuel_stations_2011",
    "method_id":  "4_4_known_mixture",
    "formula_code":  "4.4",
    "cases":  [
                  {
                      "case_id":  "4_4_known_mixture_lookup_01",
                      "title":  "4.4 lookup baseline",
                      "status":  "active",
                      "binding_target":  "Kp_max",
                      "table_id":  "Table_App_8",
                      "output_key":  "kp",
                      "resolution":  "range",
                      "evidence":  {
                                       "document":  "Prikaz OOS RK 2011 No. 196-O",
                                       "section":  "Appendix 8",
                                       "page":  null,
                                       "image_ref":  "assets/tables/Table_App_8.png"
                                   },
                      "selectors":  {
                                        "product_group":  "light",
                                        "tank_construction":  "vert",
                                        "tank_mode":  "mernik",
                                        "ssv_type":  "none",
                                        "kp_type":  "max"
                                    },
                      "expected":  {
                                       "value":  0.9,
                                       "tolerance":  {
                                                         "abs":  1E-12,
                                                         "rel":  0.0
                                                     },
                                       "unit_id":  "dimensionless"
                                   },
                      "tolerance":  {
                                        "abs":  1E-12,
                                        "rel":  0.0
                                    },
                      "axis_input":  0
                  }
              ]
}