{
    "schema_version":  1,
    "package_id":  "fuel_stations_2011",
    "method_id":  "6_6_sludge",
    "formula_code":  "6.6",
    "cases":  [
                  {
                      "case_id":  "6_6_sludge_lookup_01",
                      "title":  "6.6 lookup baseline",
                      "status":  "active",
                      "binding_target":  "n_surface_norm",
                      "table_id":  "Table_6_5",
                      "output_key":  "n_surface_norm",
                      "resolution":  "exact",
                      "evidence":  {
                                       "document":  "Prikaz OOS RK 2011 No. 196-O",
                                       "section":  "Section 6.5",
                                       "page":  30,
                                       "image_ref":  "assets/tables/Table_6_5.png"
                                   },
                      "selectors":  {
                                        "season":  "spring_summer"
                                    },
                      "expected":  {
                                       "value":  2.88,
                                       "tolerance":  {
                                                         "abs":  1E-12,
                                                         "rel":  0.0
                                                     },
                                       "unit_id":  "dimensionless"
                                   },
                      "tolerance":  {
                                        "abs":  1E-12,
                                        "rel":  0.0
                                    }
                  }
              ]
}